<!ELEMENT sucursales (sucursal+)>
<!ELEMENT sucursal (nombre, direccion, ciudad, estado, horario)>
<!ELEMENT nombre (#PCDATA)>
<!ELEMENT direccion (#PCDATA)>
<!ELEMENT ciudad (#PCDATA)>
<!ELEMENT estado (#PCDATA)>
<!ELEMENT horario (#PCDATA)>